{
  "schema_version": "1.0",
  "proposal_id": "EXAMPLE-001",
  "proposal_digest": "0000000000000000000000000000000000000000000000000000000000000000",
  "transition": "submit",
  "actor_id": "capability-agent-a",
  "recorded_at": "2026-08-12T00:00:00Z",
  "previous_hash": "0000000000000000000000000000000000000000000000000000000000000000",
  "record_hash": "0000000000000000000000000000000000000000000000000000000000000000",
  "details": {
    "example_only": true,
    "note": "Zero digests make this schema-shaped example non-evidentiary."
  }
}
